0,1,2
VizWiz_val_00004391.jpg,A restaurant coupon advertising five dollars of an Avocado Bacon To stad a Combo ,can of soup with the ingredients on the side of the back
VizWiz_val_00005265.jpg,a close up of a taped cardboard box with a white label ,can with picture of dr sauce with the ingredients on the label
VizWiz_val_00004694.jpg,Open laptop sitting on a desk next to a glass ,the front side side label of can with picture on it and picture
VizWiz_val_00005758.jpg,image shows a monitor showing boot option of a laptop ,white and red can of food with the nutrition facts on the back
VizWiz_val_00005396.jpg,A blue error screen is open on a computer ,white box of tissues with red writing on the front
VizWiz_val_00000615.jpg,Wooden speaker panels and wires and a speaker box ,can with red and yellow and red and white label on the side of the back
VizWiz_val_00000643.jpg,A brown leather wallet with a card on top ,the back of package of food with nutritional facts
VizWiz_val_00005894.jpg,TV on top of a dresser with various objects in front of it ,the side side side label on bottle of some sort of food
VizWiz_val_00003285.jpg,a sore on someone's lower arm and the thumb of the person ,can with red and yellow and red label with white lettering
VizWiz_val_00003116.jpg,Can of food it appears and in the back it seems like it a office desk with phone and computer ,white box with picture of man wearing black lettering
VizWiz_val_00001479.jpg,A computer monitor that is on and showing three columns one for email one for open webpages and one for photos ,the back of bottle with the ingredients and ingredients
VizWiz_val_00002776.jpg,An iPhone screen with a screen to enter a password and a security code to change your password ,can of soup with red label on the back of it with the ingredients and the ingredients on the side
VizWiz_val_00006361.jpg,A DVD for a Christmas movie has a boy on it ,can of food is on top of the counter
VizWiz_val_00006559.jpg,A white green and purple fabric with flower patterns ,the side of can of soup with the ingredients and nutritional facts
VizWiz_val_00006022.jpg,a pair of black ankle socks on a human leg propped up on a chair arm ,the front side of box with instructions on it
VizWiz_val_00000330.jpg,Among the prints the word office is the only one that is a bit clear ,box with picture of chocolate cereal
VizWiz_val_00002207.jpg,a lg television screen with some text written ,the side of can of coca cola on top of table
VizWiz_val_00005808.jpg,some type of advertisement on a screen or digital ,the back of box with picture on the side of can
VizWiz_val_00002670.jpg,Hand holding a white piece of paper that has black text on it ,the back of can of soup on top
VizWiz_val_00003299.jpg,Two people watching a man play video games ,the back of package with the ingredients and nutritional information on the back
VizWiz_val_00003718.jpg,A MacBook air laptop displaying a command prompt to go forward with a specific request ,the side side of package of chicken breast
VizWiz_val_00000972.jpg,A computer monitor showing files loading sits on a wood desk with a corded mouse and a wireless remote sitting in front of it ,the side of box of frozen food with the nutrition label
VizWiz_val_00000483.jpg,A Pepsi can is nestled in a fuzzy beige blanket ,the back of box with the nutrition facts on it
VizWiz_val_00002420.jpg,Computer screen monitor with a window opened up ,can of soup is sitting on counter
VizWiz_val_00000719.jpg,Two separate cards over a big long red paper with nutrition information on it ,the back of bottle with the ingredients label
VizWiz_val_00001551.jpg,A laptop computer screen with a Microsoft prompt that is on stage 4 of 5 ,the back side side label on bottle of medicine
VizWiz_val_00006939.jpg,Card with an advertisement for Chase bank with 150 gift card offer ,bottle of medicine with red and red label on the front of it
VizWiz_val_00003896.jpg,A laptop with the keyboard and a web page pulled up on the screen ,can of soup with picture of soup
VizWiz_val_00002803.jpg,A laptop screen with written text on display ,bottle of dr scented seasoning with the ingredients on the back of the bottle of it with the bottle of it is on it
VizWiz_val_00002566.jpg,Two tablet devices one with a screen showing a large magnifying glass the other on the bottom showing a screen with application icons ,white paper with the word machine on it with black lettering
VizWiz_val_00005228.jpg,A laptop is turned on and open to a a Firefox web browser that is opened to an error message on the website Oyster online ,the back of box with the ingredients and ingredients on it
VizWiz_val_00000664.jpg,The screen has a white box with an exit sign in the corner ,the side of can with the nutritional information
VizWiz_val_00004913.jpg,A double spaced manuscript shows editor's marks in red ink ,the back side side side of package of food showing the nutrition facts
VizWiz_val_00006260.jpg,a grey and cream colored tube with nourishing written on it ,can of soup is on the counter
VizWiz_val_00006403.jpg,White color washing machine and near electric socket ,can of soup with the ingredients on it
VizWiz_val_00001444.jpg,A computer screen on a website called swag bucks showing search results ,can with red and white lettering on top of it
VizWiz_val_00004091.jpg,Windows is showing a loading screen on the monitor ,the side side of can of soup with nutritional facts
VizWiz_val_00002792.jpg,a computer monitor displaying a security screen tab ,can of food with the ingredients label
VizWiz_val_00003805.jpg,a large black and white dog laying on the floor in front of a lit Christmas tree ,can with red label with white and red label on the back
VizWiz_val_00004063.jpg,A person with red nail polish is giving the middle finger ,bottle of medicine with the nutrition facts on the back of the back of it
VizWiz_val_00007548.jpg,A blue computer screen with a black keyboard ,can with picture and picture of food
VizWiz_val_00001705.jpg,The back side of a Boston machine with it's barcode on it ,white box of tissues is sitting next down
VizWiz_val_00003764.jpg,A black Sony television on a wooden stand ,white plastic bottle with black text and white label on top of it with black lettering
VizWiz_val_00003866.jpg,A black and silver Dell computer monitor displaying a webpage of mostly text ,can of food is lying on counter
VizWiz_val_00004078.jpg,A black Le novo laptop with a file open on the screen ,the back of bottle of shampoo on top
VizWiz_val_00005866.jpg,Part of a green navy and white horizontal striped polo shirt ,the back side of bottle of medicine on counter top with the ingredients on the back
VizWiz_val_00006247.jpg,The back of a bottle of a acetaminophen 500 mg ,the back of package of food with the ingredients on the side
VizWiz_val_00004252.jpg,Beautiful view from behind the walls hidden under dark mist ,the back of box of frozen dinner with the directions
VizWiz_val_00004511.jpg,A map on a computer screen with a location dot set off to the right of stairs and a tree ,box of coffee creamer is on counter
VizWiz_val_00003758.jpg,A computer monitor screenshot of a captcha page is shown ,the back of package of chicken soup with the nutrition label
VizWiz_val_00005167.jpg,a laptop screen that has tons of stuff on it ,can with red label on top of wooden surface with the ingredients
VizWiz_val_00003227.jpg,photo to the monitor of a MacBook air computer with a video paused ,white plastic bottle of coca cola on counter
VizWiz_val_00000118.jpg,a squared computer monitor sitting on a desk with wires near it ,can of soup with the nutrition label on the front
VizWiz_val_00004108.jpg,A screen saver is displayed on a computer monitor ,can with the back of food on the back of the side
VizWiz_val_00003904.jpg,A picture of a blue computer option screen ,the back of box with barcode and ingredients
VizWiz_val_00002277.jpg,A computer restart screen with a window prompting the user to restore the system ,bottle with white cap and blue label with red label on it
VizWiz_val_00006758.jpg,Small piece of strawberry flavored candy in a plastic wrapper ,the back side of bottle of medicine with nutritional information
VizWiz_val_00001401.jpg,a computer laptop monitor displaying startup prepare on it ,can with red label on top with white label
VizWiz_val_00000739.jpg,Yellow receipt paper with water spot backside facing up ,the side of box with picture of the ingredients
VizWiz_val_00002456.jpg,A sideways picture of a math question asking for a calculation of an instantaneous current ,the back of bottle of medicine with the ingredients on the back of the label and nutrition facts and nutrition facts on the side of can
VizWiz_val_00000170.jpg,A TV screen displaying a news broadcast and a shelf with an arrangement of toy ,bottle of medicine with the label showing the nutrition facts label on the label  
VizWiz_val_00000540.jpg,Some pix elated text appears on a computer screen ,the side label on can of soup
VizWiz_val_00004055.jpg,Quality issues are too severe to recognize visual content The text is heavily obscured by a light source glare ,the back side of bottle of some sort of food
VizWiz_val_00000883.jpg,A computer screen with blue desktop and text on it ,can of dr pepper soup on counter top
VizWiz_val_00004741.jpg,A portion of a computer screen with text a progress bar and a button to click ,the back side side of box of food showing nutrition label on counter
VizWiz_val_00007043.jpg,An oven display setting showing 100 degrees Bake on ,white box with the ingredients and ingredients on it
VizWiz_val_00005820.jpg,A small piece of food is on top of a damaged yellow surface ,bottle with label on it on the counter top with can of it
VizWiz_val_00005668.jpg,the back of a white paper with a cellular phone sitting on it ,white and blue and black computer keyboard on wooden table
VizWiz_val_00004139.jpg,A receipt is lying on top of a table ,box of frozen food is sitting on counter
VizWiz_val_00004368.jpg,A computer screen showing the desktop with a bunch of icons ,can with the ingredients on the back
VizWiz_val_00000397.jpg,Bronze medal with blue ribbon strap placed against hand ,bottle of beer is sitting in the table
VizWiz_val_00002915.jpg,The corner side of a wooden table that's chipped ,can with picture of soup on the counter with can
VizWiz_val_00007506.jpg,a phone showing some information about sending and receiving of messages ,can with the ingredients on the back
VizWiz_val_00004385.jpg,A screenshot of a page containing the code 38 i 9 Rg 48 ,box with picture on the side and hand of it
VizWiz_val_00003841.jpg,A to go coffee cup from the Saint Louis bread co ,the side of bottle of medicine with the nutrition facts
VizWiz_val_00001815.jpg,A piggy bank the is shaped like two pigs ,bottle with red label with white lettering on it
VizWiz_val_00006426.jpg,brown microwave dinner package on a wood table ,the back side side side side of can with the nutrition facts
VizWiz_val_00007509.jpg,A computer screen is lit up in a very dark room ,box of frozen dinner on counter
VizWiz_val_00006636.jpg,Back of a large empty Ocean Spray Cranberry Juice jug that shows the writing on the label ,the back of bottle of medicine with nutritional information
VizWiz_val_00004224.jpg,A laptop with an open tab that contains a captcha ,can of soup is on the table
VizWiz_val_00004652.jpg,an electronic with buttons and windows with numbers ,the back of package with picture of food
VizWiz_val_00002100.jpg,Part of a computer screen showing windows altering the desktop ,can of soup on top with the side of the side of the back
VizWiz_val_00003886.jpg,a computer screen showing a Windows error stating Windows could not parse or process un attend answer file ,bottle of some sort of liquid with nutritional information on it
VizWiz_val_00004660.jpg,I see a screen that says do you want to restore ,white box of frozen dinner on counter top
VizWiz_val_00007679.jpg,A package of cigarettes is lying on a table ,white bottle with the drug facts on it is on top of table
VizWiz_val_00006537.jpg,A plastic bottle full of discount soda laying on someone's lap that is wearing orange Hawaiian shorts ,white box of tissues is sitting next to white wall
VizWiz_val_00002101.jpg,A computer monitor showing that the operating system is working on some task ,the back of package with nutritional facts on the side
VizWiz_val_00006578.jpg,The package contains information about the enclosed medication ,the back of bottle of medicine on counter
VizWiz_val_00004438.jpg,A calendar with some very important date written on it ,the side of can with nutritional facts on it and nutrition facts on the side of the food are on counter
VizWiz_val_00004762.jpg,shows system some problem that person need help ,can with the ingredients on top of the back
VizWiz_val_00001548.jpg,Computer monitor displaying a Windows style warning message ,the side of can with the nutritional facts on the side
VizWiz_val_00004657.jpg,An LG computer display that is showing the system is about to restart ,bottle of beer is on the counter
VizWiz_val_00003323.jpg,A PARTIAL SNAPSHOT OF A LAPTOP COMPUTER ,white and black keyboard on the floor with the bottom left of it
VizWiz_val_00004834.jpg,The sign on the computer says it is an invalid computer key ,white and red box of frozen dinner on counter top
VizWiz_val_00000355.jpg,A blue container of some kind on a man's lap ,can of food with the ingredients label on the back
VizWiz_val_00007021.jpg,A person holding up a can of white fiesta beans ,the side of bottle with the ingredients on the back of it
VizWiz_val_00001461.jpg,A person with a laptop computer on their lap ,white and black keyboard on white background
VizWiz_val_00005382.jpg,Computer or laptop screen showing some of Turbo Tax's website ,can of coca cola on counter
VizWiz_val_00002535.jpg,The back of a receipt with a green label stating that it is recyclable ,can of soup is on top with red label
VizWiz_val_00006869.jpg,building toy that's green on the surface and has two black wheels a blue hard hat and light wooden surface ,white box of tissues on top of table
VizWiz_val_00003220.jpg,appears to be a picture of a street ,white and black computer keyboard with the word keyboard on it
VizWiz_val_00002373.jpg,An image of a computer screen with items on display ,the side of box with the nutrition facts on it is on the back of the table
VizWiz_val_00001051.jpg,Some sort of credit or ATM card held by someone ,the side of bottle with the nutrition label on the back of it
VizWiz_val_00003074.jpg,A pair of eyeglasses that has a safety pin holding the hinge together laying on top of a book with Hebrew or Arabic writing ,white and red box with white writing on the left side of it
VizWiz_val_00002321.jpg,a computer screen with a question in the center and the word exiting at the top ,the back side of can of soup with nutritional information
VizWiz_val_00004962.jpg,A white piece of paper with Install Mac OS X on it rests on a gray cloth surface ,bottle of beer on counter top with the back of the nutrition label
VizWiz_val_00003334.jpg,A ride fare card for a public transit service lying on a table ,can of soup is sitting on the counter with the back of the nutrition label
VizWiz_val_00005008.jpg,Laptop screen with Windows 7 logo and installation page with blue buttons ,bottle with red and white label with red writing
VizWiz_val_00001751.jpg,A lottery ticket with numbers on it that is sitting on a cushion ,can of soup is on the table
VizWiz_val_00005086.jpg,A device has a screen with Sirius XM on it ,can with red and yellow and white label on wooden table with the back of it and other items
VizWiz_val_00004827.jpg,A package containing a copy of Microsoft Office Enterprise is shown ,the side label on bottle with the back label
VizWiz_val_00001772.jpg,a framed painting of two adolescent girls playing with a kite ,can with the nutrition facts on the side
VizWiz_val_00001196.jpg,A desktop computer monitor on a short stand has a keyboard in front of it ,white plastic bottle with red label on it
VizWiz_val_00002668.jpg,A computer screen is showing a startup repair function ,box of frozen broccoli on top with picture of the side of the back
VizWiz_val_00007733.jpg,a crack in concrete running from the lower left corner to the top right corner of the picture ,can of soup on top of counter
VizWiz_val_00002016.jpg,a few pop ups on a computer screen that are in Spanish ,the back of bottle with nutritional facts and nutrition label
VizWiz_val_00006296.jpg,A bottle of gum sitting on a checkered brown and white table cloth ,white and green package of frozen dinner with picture of the ingredients
VizWiz_val_00003893.jpg,a TV with a bunch of stuff on top of it ,can of food with picture of the food
VizWiz_val_00001482.jpg,The computer screen has some menu options at the top ,white and black computer mouse with the screen on it is on the table
VizWiz_val_00003237.jpg,a black color background screen of a laptop computer system ,the back side of package of food with the ingredients on it
VizWiz_val_00000328.jpg,A black laptop with an error message across the screen is sitting against a blue background ,the back of can of food showing nutrition facts
VizWiz_val_00000648.jpg,some kind of appliance that's white and has warning and code ,can with red label on top of wooden table
VizWiz_val_00003599.jpg,A black disc carrier with a white label on it sitting on a black surface on black and green striped fabric ,the back of package with picture on the side
VizWiz_val_00002945.jpg,A box of coasters are square shaped and on a black table ,bottle of some kind with label on the back
VizWiz_val_00002078.jpg,The screen with text wants you to register a product ,can of soup with picture of the nutrition facts on it
VizWiz_val_00001123.jpg,The upper portion of a mobile phone on a wooden reflective surface ,white and black laptop computer keyboard with the word computer and the windows visible
VizWiz_val_00000396.jpg,A gold medal for the American Cancer Society ,the front side side of bottle with red label
VizWiz_val_00002788.jpg,Left hand holding an envelope with green flooring in the background ,bottle of medicine on top of table top
VizWiz_val_00006727.jpg,A granola bar box sits on a table cloth with other items ,the back of package of food with nutritional information
VizWiz_val_00001036.jpg,an open laptop is on and shows a blurry configuration screen ,can of soup with the ingredients on it on the back
VizWiz_val_00004464.jpg,A Windows 7 desktop showing a warning that the feature requires a floppy disk or USB drive ,bottle of some kind of food that is in container
VizWiz_val_00005438.jpg,A startup repair error message stating the computer was unable to start and asking if you want to restore it ,white and black laptop computer keyboard with the word keyboard on the screen 
VizWiz_val_00006498.jpg,Tartan plat woven wool with brown and black checks ,bottle with red label with red cap on the back
VizWiz_val_00005058.jpg,Receipt with the total being 15 paid by a Visa card ,can with red label with picture on it
VizWiz_val_00006465.jpg,the keyboard to a laptop computer that is open but not powered on ,the side side of can of food with nutritional facts and nutritional information on the side
VizWiz_val_00005316.jpg,A LG thick TV is on a wooden table ,the back side on bottle of wine with the nutrition facts and the ingredients on it with the back
VizWiz_val_00005196.jpg,two clear plastic bottles of nestle brand pure life water ,the back of box with picture of the ingredients on it is on top of the back
VizWiz_val_00001378.jpg,A PlayStation game MLB 10 The Show lies on a patterned rug ,white box with the ingredients and barcode on the side of it
VizWiz_val_00006221.jpg,Remote control for a television on top of a couch ,the side side label on bottle of some sort of liquid that is red
VizWiz_val_00001023.jpg,A CD is in a black and clear case ,bottle with white label with black and white label on it
VizWiz_val_00002587.jpg,Blue laptop screen showing startup repair sign and mouse click er ,the side of bottle with white label with the ingredients and ingredients on it with picture of the back
VizWiz_val_00005411.jpg,A good condition tablet or iPad with a cup of Starbucks coffee over it ,can of soup with the nutritional facts
VizWiz_val_00007267.jpg,A very wonderful view and worth seeing at all times my friend ,can with red label with white and blue label
VizWiz_val_00002857.jpg,A monitor displays what appears to be a Windows error message ,can of soup is sitting on the counter
VizWiz_val_00005277.jpg,A computer monitor showing a windows dialog box for System Restore ,white and red box with the text on the side of it on the left of white surface with red box
VizWiz_val_00001746.jpg,a computer screen showing the set up password screen for windows computer system ,the back side of bottle of pills with the ingredients on it
VizWiz_val_00003026.jpg,A computer screen with a photo of a woman that has a heart shaped patch over her eye on top of that is some type of pop up screen ,the back side side side of can of food with nutritional facts
VizWiz_val_00005865.jpg,Appears to be a picture of a green shirt ,can of soup is lying on counter
VizWiz_val_00000532.jpg,A windows XP screen with the message window is shutting down ,bottle with white cap on it with black lettering
VizWiz_val_00001736.jpg,a laptop computer screen that is turned on ,can with red and yellow and blue label
VizWiz_val_00001629.jpg,A computer screen with a pop up window asking no or yes ,can of food is on counter top
VizWiz_val_00007281.jpg,A person is wearing a green shirt and has a belt coming out from his pants ,the side side of box of food showing nutrition facts and nutrition label
VizWiz_val_00000430.jpg,some knuckles on wood counter with money on it ,bottle with red label with white lettering and red lettering
VizWiz_val_00003523.jpg,A laptop showing its keyboard and half of the screen ,can with the nutrition facts on it on the side
VizWiz_val_00001808.jpg,a book by Clive and Dirk Cuss ler with a sunset and mountains and a metal machine on the front ,can of food with the nutrition facts on it of it
VizWiz_val_00004943.jpg,a red box for a jawbone j ambox that has the FCC id and serial number printed on the side ,bottle with white cap on top
VizWiz_val_00003947.jpg,Menus lying on a restaurant table white and pink ,box of chocolate bars is on counter top with plastic bag of coffee
VizWiz_val_00003607.jpg,A black electronic device with cables running on the top of it with a white tag on the back ,white box with picture of food inside
VizWiz_val_00007163.jpg,Corner of room with closet door and bright light coming through blinds ,the side of bottle with white cap
VizWiz_val_00007097.jpg,A deep dark plain surface with no obstacles are found ,the side of box with the directions and ingredients
VizWiz_val_00000234.jpg,A television sitting on a wooden table below some shelves ,the side side side of box with picture of the food on the back
VizWiz_val_00004927.jpg,A desk with a bag of snacks a computer monitor and a keyboard ,can with picture of food on the counter
VizWiz_val_00003796.jpg,A desktop monitor turned on with internet explorer open on a school website displaying a math problem with 4 answers to pick from ,white piece on top with black and white and white writing on it
VizWiz_val_00004885.jpg,A computer monitor display of a Google search ,the front of box of microwave dinner with the ingredients and nutritional facts
VizWiz_val_00004743.jpg,A computer monitor is pictures with a black background screen and a startup repair window open as it seems unable to start ,can of soup with the nutritional label on the side
VizWiz_val_00006193.jpg,Pictured is a man in the frame making a funny face with a caption ,can of food with nutritional information on the side
VizWiz_val_00003800.jpg,A calling sim card with a barcode and scratch off pin number un scratched ,the side of bottle of some kind with food label
VizWiz_val_00004794.jpg,A person rests their hand next to a label lying on a white piece of paper ,can with red and white label with red label
VizWiz_val_00005710.jpg,A laptop displaying an error message with white text on a blue screen ,the back of bottle of some kind with the ingredients on it   
VizWiz_val_00001948.jpg,a TV displaying a warning about severe thunderstorms from the national weather service ,can of coca cola on top of wooden table
VizWiz_val_00006886.jpg,A set of blinds are halfway closed on a window ,can with the ingredients on it is on top of the table
VizWiz_val_00007615.jpg,A white touchscreen phone with a grey case on it ,can with red label on top of stove top
VizWiz_val_00005040.jpg,A large grey Samsung CRT television with audio video output cables ,box of tissues on top of counter
VizWiz_val_00003492.jpg,A computer monitor with the screen on and displaying the desktop ,hand holding up cup with red and blue text on the back of it
VizWiz_val_00001995.jpg,image showing the text on a computer screen in dark environment ,white box with picture of man wearing black writing
VizWiz_val_00003639.jpg,The rear of a credit card showing a white background and black stripe ,box of frozen food is on top of table
VizWiz_val_00002671.jpg,A sheet of paper with faded lines and tables and text ,box of frozen dinner with picture on the back of it with the box of it
VizWiz_val_00006458.jpg,A clear plastic bottle of Crystal Geyser spring water ,the back side of can with the ingredients on it
VizWiz_val_00002224.jpg,A white card on the black table with a man's leg wearing in blue jeans on the side of the table ,can with the back label on the back
VizWiz_val_00001106.jpg,a laptop computer screen showing Assist ive Ware website ,the back of package with the nutrition label on it is on top of counter top with can of food
